author details,urls,unique ID,book title,author name,rating,book description,book_cover_links,v4 UUID
,https://www.goodreads.com/book/show/29610595-too-late?from_search=true&from_srp=true&qid=1t02z5usua&rank=22,29610595,Too Late,by Colleen Hoover (Goodreads Author),3.94,"Sloan will go through hell and back for those she loves.
And she does, every single day.
After finding herself stuck in a relationship with the dangerous and morally corrupt Asa Jackson, Sloan will do whatever it takes to get by until she's able to find a way out.
Nothing will get in her way.
Nothing except Carter.

Sloan is the best thing to ever happen to Asa. And if you ask Asa, he'd say he's the best thing to ever happen to Sloan. Despite Sloan's disapproval of Asa's sinister lifestyle, he does exactly what he needs to do in order to stay a step ahead in his business. He also does exactly what he needs to do in order to stay a step ahead of Sloan.
Nothing will get in his way.
Nothing except Carter.

From New York Times bestselling author, Colleen Hoover, writing as C. Hoover.
This book was originally written as a side project by the author. It previously appeared on other platforms under the same title, but has since been slightly edited from its original content and formatted specifically for kindle. Please note that the content of this book is more graphic than the content of other books written by this author, hence the distinction between the names. This title is recommended for mature audiences only due to extreme graphic content. Recommended for readers 18+.
Warning: For readers who might be triggered by sensitive subject matter, this book contains scenes which depict rape, murder and other graphic violence. (less)",https://i.gr-assets.com/images/S/compressed.photo.goodreads.com/books/1459520906l/29610595.jpg,03967ee6-1a74-46a0-8ec8-b36e1f076bf7
,https://www.goodreads.com/book/show/23587984-maybe-not?from_search=true&from_srp=true&qid=1t02z5usua&rank=23,23587984,Maybe Not,by Colleen Hoover (Goodreads Author),3.91,"Colleen Hoover, the New York Times bestselling author of Maybe Someday brilliantly brings to life the story of the wonderfully hilarious and charismatic Warren in a new novella, Maybe Not.

When Warren has the opportunity to live with a female roommate, he instantly agrees. It could be an exciting change.

Or maybe not.

Especially when that roommate is the cold and seemingly calculating Bridgette. Tensions run high and tempers flare as the two can hardly stand to be in the same room together. But Warren has a theory about Bridgette: anyone who can hate with that much passion should also have the capability to love with that much passion. And he wants to be the one to test this theory.

Will Bridgette find it in herself to warm her heart to Warren and finally learn to love?

Maybe.

Maybe not. (less)",https://i.gr-assets.com/images/S/compressed.photo.goodreads.com/books/1416381591l/23587984.jpg,56a15fef-0ebd-4efa-be7e-ba31c26d9309
,https://www.goodreads.com/book/show/60174072-by-colleen-hoover?from_search=true&from_srp=true&qid=1t02z5usua&rank=24,60174072,By Colleen Hoover,by calvin drugs,4.36,no book description available,https://i.gr-assets.com/images/S/compressed.photo.goodreads.com/books/1642764589l/60174072._SY475_.jpg,5f9a529d-35ab-4261-94e8-7d2a34cf1c2f
,https://www.goodreads.com/book/show/59759132-verity-by-colleen-hoover-notebook-paperback-with-8-5-x-11-in-100-pages?from_search=true&from_srp=true&qid=1t02z5usua&rank=25,59759132,Verity by Colleen Hoover notebook paperback with 8.5 x 11 in 100 pages,by James Green,4.50,no book description available,https://i.gr-assets.com/images/S/compressed.photo.goodreads.com/books/1638733894l/59759132._SX318_.jpg,ba52ef81-4a8d-4ed7-a14a-a81c1788a80f
,https://www.goodreads.com/book/show/25174251-confess?from_search=true&from_srp=true&qid=1t02z5usua&rank=26,25174251,Confess: A Novel by Colleen Hoover | Summary & Analysis,by Book*Sense,4.01,"Confess: A Novel by Colleen Hoover | Summary & Analysis

This is a Summary & Analysis of Confess. Colleen Hoover is a writer who first came to bestsellerdom through the back door of self-publishing. Signs of the author's spunk and energy fill this novel, which is highly readable, funny in all the right places, but also heart-breaking. Readers who value complex character-development and moral ambiguity won't find much to love in Confess, but the novel is a fun and clever story of two very unlucky young people who find redemption in each other.

Confess is romantic story about two young people, Auburn and Owen, who both have difficult pasts they'd like to keep secret. When Owen hires Auburn to work in his art gallery, their immediate attraction is hard to ignore; for the first time in years, they each feel as if they've found someone who understands them. However, the secrets Auburn is hiding means that she has to stay away from Owen, no matter how impossible that seems.

This companion to Confess also includes the following:
• Book Review
• Story Setting Analysis of Confess
• Story elements you may have missed as we decipher the novel
• Details of Characters & Key Character Analysis
• Summary of the text, with some analytical comments interspersed
• Thought Provoking /or Discussion Questions for both Readers & Book Clubs
• Discussion & Analysis of Themes, Symbols…
• And Much More!

It is an original and entertaining romance, filled with quirky characters, surprising secrets and clever plot twists. The idea of ""confession"" is explored at all levels. How much does a confession imply guilt? Are all secrets guilty secrets?

This Analysis of Confess fills the gap, making you understand more while enhancing your reading experience. (less)",https://i.gr-assets.com/images/S/compressed.photo.goodreads.com/books/1426763776l/25174251.jpg,dd81f1f5-29d9-4a24-a3ce-3d84e1056eb7
,https://www.goodreads.com/book/show/25454883-never-never?from_search=true&from_srp=true&qid=1t02z5usua&rank=27,25454883,Never Never: Part Three,"by Colleen Hoover (Goodreads Author), Tarryn Fisher (Goodreads Author)",3.50,"New York Times bestselling authors Colleen Hoover and Tarryn Fisher are back with the much-anticipated final installment in the Never Never novella series.

Together, Silas Nash and Charlize Wynwood must look deeper into the past to find out who they were and who they want to be. With time ticking down, the couple are in a race to find the answers they need before they lose everything.

Can they regain what they once had? And will it restore who they once were? (less)",https://i.gr-assets.com/images/S/compressed.photo.goodreads.com/books/1443033152l/25454883._SY475_.jpg,308f4ab8-61a7-4000-a0e9-b48abd175453
,https://www.goodreads.com/book/show/19390926-point-of-retreat?from_search=true&from_srp=true&qid=1t02z5usua&rank=28,19390926,Point of Retreat,by Colleen Hoover (Goodreads Author),4.25,"From the bestselling author of Slammed, comes Colleen Hoover's next big hit.
Layken and Will have managed to overcome the obstacles that threatened to destroy their love, proving that they are destined for one another. What they are about to learn, however, is that the things that have brought them together may be the very things that ruin their connection forever…
Layken is left second-guessing the relationship whilst Will is jumping over hurdles to prove his love for her. What the young lovers discover about themselves along this journey may change their entire world and the lives of those who depend upon them the most...
Praise for Colleen Hoover:
'As brilliant and entertaining as Slammed, Point of Retreat is absolute poetry.' - JAMIE MCGUIRE, New York Times bestselling author of Beautiful Disaster
'I finished reading Slammed at 1am on Sunday... I couldn't wait to start reading Point of Retreat so I bought it right then and there!' - Amazon Review (less)",https://i.gr-assets.com/images/S/compressed.photo.goodreads.com/books/1386839665l/19390926.jpg,bc9ab3fb-c48f-49f2-b6f8-21222bd2a6c7
,https://www.goodreads.com/book/show/18631291-finding-cinderella?from_search=true&from_srp=true&qid=1t02z5usua&rank=29,18631291,Finding Cinderella,by Colleen Hoover (Goodreads Author),4.19,"A chance encounter in the dark leads eighteen-year-old Daniel and the girl who stumbles across him to profess their love for each other. But this love has conditions: they agree it will last only one hour, and it will be only make-believe.

When their hour is up and the girl rushes off like Cinderella, Daniel tries to convince himself that what happened between them seemed perfect only because they were pretending it was. Moments like that happen only in fairy tales.

One year and one bad relationship later, his disbelief in love-at-first-sight is stripped away the day he meets Six: a girl with a strange name and an even stranger personality. Unfortunately for Daniel, finding true love doesn""t guarantee a happily ever after... it only further threatens it.

Will an unbearable secret from the past jeopardize Daniel and Six's only chance at saving each other? (less)",https://i.gr-assets.com/images/S/compressed.photo.goodreads.com/books/1381082896l/18631291.jpg,a9a4c090-2bd5-46e6-afd6-f2bc31572870
,https://www.goodreads.com/book/show/42657538-maybe-now?from_search=true&from_srp=true&qid=1t02z5usua&rank=30,42657538,Maybe Now,by Colleen Hoover (Goodreads Author),4.06,"What is more important? Friendship, loyalty, or love?

Ridge and Sydney are thrilled to finally be together guilt-free. But as the two of them navigate this freedom, Warren and Bridgette’s relationship is as tumultuous as ever, and Maggie grapples with her illness.

When she comes across an old list of things she wanted to do “maybe one of these days,” Maggie decides to live life to the fullest and accomplish these dreams. Maggie keeps Ridge updated on her adventures, but he can’t help but worry, even as Sydney grows more and more suspicious about their friendship. But if she’s going to move past this jealousy, she’ll need to reconcile how she and Ridge came together with the fact that Maggie will always be in their lives somehow…or end up walking away from the man she loves so much.

Featuring new songs by Griffin Peterson, this emotive and satisfying finale proves that maybe someday might be right now. (less)",https://i.gr-assets.com/images/S/compressed.photo.goodreads.com/books/1541746506l/42657538._SY475_.jpg,bf43f288-ff11-4549-a937-ff45c2c01029
,https://www.goodreads.com/book/show/24422492-never-never?from_search=true&from_srp=true&qid=1t02z5usua&rank=31,24422492,Never Never: Part Two,"by Colleen Hoover (Goodreads Author), Tarryn Fisher (Goodreads Author)",4.02,"“Never forget that I was your first real kiss. Never forget that you’ll be my last.
And never stop loving me between all of them.
Never stop, Charlie.
Never forget.”

Silas races against time as more truths unravel, while others twist tighter together. And now, the stakes are higher as Silas’ control slips and others begin to point fingers. Charlie is in trouble and he must be the one to bridge the chasm between their past and their present. Because somewhere between I love yous and Never Nevers and Never Agains, a truth they can't imagine, beckons to be found.

“Where are you, Charlie?” (less)",https://i.gr-assets.com/images/S/compressed.photo.goodreads.com/books/1420928158l/24422492.jpg,51849e6e-b9c8-41d4-9588-1c9d1585152c
,https://www.goodreads.com/book/show/49018309-finding-perfect?from_search=true&from_srp=true&qid=1t02z5usua&rank=32,49018309,Finding Perfect,by Colleen Hoover (Goodreads Author),4.31,"Finding Perfect is a novella that brings back some of Colleen’s most beloved characters. Told from the point of view of Daniel from Finding Cinderella, readers will finally get the conclusion they’ve been hoping for.

For the best reading experience, make sure you’ve read all four books that come together to make up this heartwarming story: Hopeless, Losing Hope, Finding Cinderella, and All Your Perfects. (less)",https://i.gr-assets.com/images/S/compressed.photo.goodreads.com/books/1575153032l/49018309._SY475_.jpg,3271ead7-b381-4b16-8c4f-683b12793bd6
,https://www.goodreads.com/book/show/28929274-colleen-hoover?from_search=true&from_srp=true&qid=1t02z5usua&rank=33,28929274,Colleen Hoover: Complete Series Reading Order & Checklist,by R.J. Michaels (Editor),3.50,"We Hope You Enjoy The Books of Colleen Hoover. Part of the Top Romance Authors Reading Order & Checklists Series.
This Is a Made For Kindle, Complete Reading Order & Checklist Compilation of The Awesome Books of Colleen Hoover. Included In The List Are all Her Standalone Titles and Her Series, Slammed, Hopeless, and Maybe Series.The Amazon Link for Each Book, is Listed Beside Each Book. This Book Is FREE With Your Kindle Unlimited Subscription.
Look For Additional Authors to The Series...Coming Soon, in The Top Authors Series!
Scroll Up & Grab a Copy to Enjoy, Today! (less)",https://i.gr-assets.com/images/S/compressed.photo.goodreads.com/books/1454546703l/28929274._SY475_.jpg,87be0bc0-b49c-49a8-acec-f06cfa04d3c4
,https://www.goodreads.com/book/show/37168513-never-never?from_search=true&from_srp=true&qid=1t02z5usua&rank=34,37168513,Never Never: The Complete Series,"by Colleen Hoover (Goodreads Author), Tarryn Fisher (Goodreads Author)",3.87,"#1 New York Times bestselling author of Hopeless joins forces with the New York Times bestselling author of Mud Vein. Together, they have created a gripping, romantic tale unlike any other. ""How odd to be made of flesh, balanced on bone, and filled with a soul you've never met.""
Charlize Wynwood and Silas Nash have been best friends since they could walk. They've been in love since the age of fourteen. But as of this morning...they are complete strangers. Their first kiss, their first fight, the moment they fell in love...every memory has vanished. ""I don't care what our real first kiss was,"" he says. ""That's the one I want to remember.""
Charlize and Silas must work together to uncover the truth about what happened to them and why. But the more they learn about the couple they used to be...the more they question why they were ever together to begin with.
""I want to remember what it feels like to love someone like that. And not just anyone. I want to know what it feels like to love Charlie."" (less)",https://i.gr-assets.com/images/S/compressed.photo.goodreads.com/books/1512845296l/37168513._SX318_.jpg,c0cc8195-cbd3-4616-aec0-b86ef5f40c70
,https://www.goodreads.com/book/show/20763048-colleen-hoover-s-point-of-retreat?from_search=true&from_srp=true&qid=1t02z5usua&rank=35,20763048,Colleen Hoover's Point of Retreat: 27 Things You Must Know,by Magdalene Fraser,4.04,"This eBook includes 27 Essential facts about the Bestselling 'Point of Retreat' by Colleen Hoover.

You can read this before or after 'Point of Retreat' to get the mood of the book, the reviewers, critics, admirers and to find out what all the fuss about this book and why it is in the bestseller lists.

This edition is updated for both US and UK readers. (less)",https://i.gr-assets.com/images/S/compressed.photo.goodreads.com/books/1392019138l/20763048.jpg,a9f21822-110e-44c0-9b0e-d8b5b0d01d6e
,https://www.goodreads.com/book/show/59449939-two-more-days?from_search=true&from_srp=true&qid=1t02z5usua&rank=36,59449939,Two More Days,"by Colleen Hoover (Goodreads Author), Aileen Erin (Goodreads Author), Alessandra Torre (Goodreads Author), Chanda Hahn (Goodreads Author), Charleigh Rose (Goodreads Author), Dominique Laura (Goodreads Author), Eric R. Asher (Goodreads Author), Ilsa Madden-Mills (Goodreads Author), more…",4.05,"The Bookworm Box is proud to present Two More Days, our second anthology installment. Much like the first installment, Two More Days is an exciting and unique reading experience with contributions from several of our charity's featured authors. Each author was given the same first sentence. Where they took that sentence was completely up to them.

Every story is different. No story is related.

The only thing these stories have in common is their starting point. Each author showcased in this anthology was featured in The Bookworm Box in 2020. Each author has graciously donated their story so that 100% of profits from this anthology will be going to the various charities The Bookworm Box is able to support because of you, the readers. (less)",https://i.gr-assets.com/images/S/compressed.photo.goodreads.com/books/1635193915l/59449939._SY475_.jpg,6d434257-1ca7-4caf-9bbf-764322675870
,https://www.goodreads.com/book/show/34540452-confess?from_search=true&from_srp=true&qid=1t02z5usua&rank=37,34540452,Confess: A Novel By Colleen Hoover | Conversation Starters,by Daily Books,4.05,"Confess: A Novel by Colleen Hoover | Conversation Starters
Limited Time Offer: $3.99 ($4.99)

Confess, a novel written by Colleen Hoover, is a story of romance, untold secrets and confessions. It revolves around a girl, Auburn, who has a painful past and is struggling to make ends meet. She finds a job at the Dallas art studio where she is hired by Owen Gentry, an enigmatic artist who needs help with his art gallery. Owen has a mysterious past which he never wants to disclose as it will result in the complete destruction of everything important to Auburn.
Auburn has started developing feelings for Owen, which is not a good sign for her. Owen also loves her but it becomes necessary to tell her the truth about his past as only a confession can now save their relationship. This can either bring both of them closer or they may part ways forever.
“I could tell her how I know her. Make her realize why I have this overwhelming urge to protect her. But some secrets I’ll take to my grave, and this is definitely one of them.” – Owen Gentry
Confess by Colleen Hoover is the winner of the Goodreads Choice Awards 2015 for Best Romance. The Guardian and USA Today have given it a 5 out of 5-star rating.


A Brief Look Inside:

EVERY GOOD BOOK CONTAINS A WORLD FAR DEEPER
than the surface of its pages. The characters and its world come alive,
and even after the last page of the book is closed,
the story still lives on, inciting questions and curiosity.
Conversation Starters is peppered with questions designed to
bring us beneath the surface of the page
and invite us into this world that continues to lives on.

These questions can be used to…


Create Hours of Conversation:
• Foster a deeper understanding of the book
• Promote an atmosphere of discussion for groups
• Assist in the study of the book, either individually or corporately
• Explore unseen realms of the book as never seen before

Disclaimer: This book you are about to enjoy is an independent resource to supplement the original book, enhancing your experience of Confess. If you have not yet purchased a copy of the original book, please do before purchasing this unofficial Conversation Starters.

Download your copy today for a Limited Time Discount: $3.99 ($4.99)
Read it on your PC, Mac, iOS or Android smartphone, tablet and Kindle devices. (less)",https://i.gr-assets.com/images/S/compressed.photo.goodreads.com/books/1489352752l/34540452._SY475_.jpg,37816010-9a3c-46dc-b509-48eef30eb60b
,https://www.goodreads.com/book/show/44020645-summary?from_search=true&from_srp=true&qid=1t02z5usua&rank=38,44020645,"Summary: ""Verity"" by Colleen Hoover | Discussion Prompts",by bestof.me,3.89,"The #1 New York Times bestselling author Colleen Hoover writes a tragic romantic thriller entitled Verity. This book is about Lowen Ashleigh, a struggling writer who was on the brink of financial ruin. At this time, she accepted the job offer of a lifetime. It was the husband of bestselling author Verity Crawford who hired her. Jeremy Crawford needed Lowen to complete the remaining books that his wife couldn’t finish in the successful series she was writing because of her injury. When Lowen started in the job, she found an unfinished autobiography that Verity never wanted for anyone to read. Because of the bone-chilling admissions in it, Lowen decided to keep the manuscript hidden from Jeremy. Its contents would forever devastate Jeremy. As Lowen develops romantic feelings for Jeremy, she thought he could benefit if he were to read the words of his wife. The horrifying truth that Jeremy read would make it impossible for him to continue loving Verity. 

In this comprehensive look into Verity by Colleen Hoover , you'll gain insight with this essential resource as a guide to aid your discussions. Be prepared to lead with the following: Discussion aid which includes a wealth of prompts and information Overall plot synopsis and author biography Thought-provoking discussion questions for a deeper examination Creative exercises to foster alternate “if this was you” discussions And more!
 
Disclaimer: This is a companion guide based on the work Verity by Colleen Hoover and is not affiliated to the original work or author in any way. It does not contain any text of the original work. If you haven’t purchased the original work, we encourage you to do so first. (less)",https://i.gr-assets.com/images/S/compressed.photo.goodreads.com/books/1550284137l/44020645._SY475_.jpg,304cfaec-c6fe-4dfd-896a-dc69fc7008fe
,https://www.goodreads.com/book/show/50433789-maybe-now-maybe-not?from_search=true&from_srp=true&qid=1t02z5usua&rank=39,50433789,Maybe Now. Maybe Not,"by Colleen Hoover (Goodreads Author), Piotr Grzegorzewski (Translator)",4.05,"Maybe Now

Ridge najchętniej nie rozstawałby się z Sydney, jednak musi pomóc swojej byłej, z którą się przyjaźni. Po rozstaniu z nim Maggie postanowiła żyć pełnią życia i zrobić to wszystko, na co wcześniej nie miała odwagi. Kiedy skacze ze spadochronem, poznaje niezwykle inteligentnego i przystojne go Jake'a. Jednak obiecała sobie, że już z nikim się nie zwiąże, bo dzięki temu uniknie rozczarowań.

Może jednak warto czasem zaryzykować?
Może właśnie teraz?

Maybe Not

Co się stanie, kiedy charyzmatyczny i zabawny Warren zamieszka z zimną i wredną Bridgette? Może uda mu się ją przekonać, że warto czasem zdjąć pancerz i otworzyć się na miłość? A może nie...

Dwie wyjątkowe historie, wiele pytań: Czy miłość pojawi się tam, gdzie nikt na nią nie czeka? Może warto postawić wszystko na jedną kartę? Może właśnie teraz? A może jednak nie... (less)",https://i.gr-assets.com/images/S/compressed.photo.goodreads.com/books/1578938910l/50433789._SY475_.jpg,b4b3143a-ba98-4127-9307-106775947937
,https://www.goodreads.com/book/show/33889257-colleen-hoover-s-ugly-love---for-fans?from_search=true&from_srp=true&qid=1t02z5usua&rank=40,33889257,Colleen Hoover's Ugly Love - For Fans (Trivia-On-Books),by Trivion Books,4.13,"Trivia-on-Book: Ugly Love by Colleen Hoover
Take the challenge yourself and share it with friends and family for a time of fun!

Tate Collins and Miles Archer meet when the former moves in to her brother’s apartment in San Francisco while looking for a job. Tate later develops a strong physical attraction towards Miles. Since she has no time for love, she agrees to a friends-with-benefits kind of relationship with him, which also requires two rules: that she never asks about his past and never expects a future. Miles, on the other hand, has a difficult past with a girl named Rachel, which makes it hard for him to return Tate’s growing feelings.
Colleen Hoover’s Ugly Love is a romantic and steamy novel published in 2014. It became a New York Times bestseller and has a movie adaptation which stars Nick Bateman.


You may have read the book, but not have liked it.

You may have liked the book, but not be a fan.

You may call yourself a fan, but few truly are. Are you a fan?

Trivia-on-Books is an independently curated trivia quiz on the book for readers, students, and fans alike. Whether you're looking for new materials to the book or would like to take the challenge yourself and share it with your friends and family for a time of fun, Trivia-on-Books provides a unique approach to Ugly Love by Colleen Hoover that is both insightful and educational!

Features You'll Find Inside:

• 30 Multiple choice questions on the book, plots, characters and author

• Insightful commentary to answer every question

• Complementary quiz material for yourself or your reading group

• Results provided with scores to determine ""status""

Promising quality and value, come play your trivia of a favorite book!!
(less)",https://i.gr-assets.com/images/S/compressed.photo.goodreads.com/books/1484675466l/33889257._SY475_.jpg,73a7642e-28f5-412c-bb9f-4c24ed7478c9
,https://www.goodreads.com/book/show/22892100-hopeless-losing-hope-finding-cinderella?from_search=true&from_srp=true&qid=1t02z5usua&rank=41,22892100,Hopeless / Losing Hope / Finding Cinderella,by Colleen Hoover (Goodreads Author),4.58,"Follow four unforgettable characters--Sky and Dean, Daniel and Six--on their journeys to happily ever after in this special collection from #1 New York Times bestselling author Colleen Hoover.

HOPELESS
When Sky first meets Dean Holder, he both terrifies and intrigues her--and his well-kept secrets may turn out to dismantle her entire life and open the wounds of her own dark past.

LOSING HOPE
Haunted by the little girl he couldn't save from immediate danger, Holder's life has been overshadowed by guilt, and it is only in loving Sky that he can finally begin to heal himself.

FINDING CINDERELLA
Daniel's disbelief in love at first sight is stripped away the day he meets Six, a girl with a strange name and an even stranger personality. But unfortunately for Daniel, finding true love doesn't guarantee a happy ending...not outside of a fairytale. (less)",https://leadershiftinsights.com/wp-content/uploads/2019/07/no-book-cover-available-300x300.jpg,d322f8df-0ec8-4935-aacb-cd6d3e56aadc
