author details,urls,unique ID,book title,author name,rating,book description,book_cover_links,v4 UUID
,https://www.goodreads.com/book/show/60620599-summary-of-verity-by-colleen-hoover-detailed-chapter-analysis-study-guid?from_search=true&from_srp=true&qid=1t02z5usua&rank=42,60620599,Summary of Verity by Colleen Hoover Detailed Chapter Analysis Study Guide,by Pandabook Plus,0.00,no book description available,https://i.gr-assets.com/images/S/compressed.photo.goodreads.com/books/1647310007l/60620599._SY475_.jpg,85ad3796-9032-4c20-9bcc-c084dcca07f2
,https://www.goodreads.com/book/show/35248659-colleen-hoover-books-checklist?from_search=true&from_srp=true&qid=1t02z5usua&rank=43,35248659,Colleen Hoover Books Checklist: Never Never Series in Order and List of All Colleen Hoover Books,by List Series,3.71,"Reading order of Never Never Series by Colleen Hoover and an exhaustive list of all her books (over 15!)
A complete list of every Colleen Hoover book published, to read and keep an easy track of, with links to the books on Amazon!

Colleen Hoover has authored some amazing books like the Never Never series. As a fan, all of us want to know her complete treasure of books she has authored, so we can continue to enjoy her writing.
Colleen Hoover has penned lot of books (over 15!) and our endeavor is to provide you with a comprehensive list of every Colleen Hoover title published. With this list, it is very easy to keep track of what you have already read and what you are yet to read.

How this book is useful: You can use this as a checklist to track which Colleen Hoover books you have already read You will be able to go through the complete list of books by Colleen Hoover as well as the reading order of the series she has written Links to Colleen Hoover’s books on Amazon is included to facilitate buying her books that you have not yet read You get to read the synopsis and reviews of her books on Amazon once you follow the links to her books
Get your copy now and be updated on Colleen Hoover books!

PLEASE NOTE: THIS IS A TITLE LIST ONLY, compiled for reference purposes to assist readers. No copyrighted material from the titles listed is included. This list is compliant with United States Copyright Office circular 34.
(less)",https://i.gr-assets.com/images/S/compressed.photo.goodreads.com/books/1495999608l/35248659._SY475_.jpg,3e08a4c7-14d4-46b4-9420-14c5e8a40ff2
,https://www.goodreads.com/book/show/33297186-hope-forever-looking-for-hope?from_search=true&from_srp=true&qid=1t02z5usua&rank=44,33297186,Hope Forever / Looking for Hope,"by Colleen Hoover (Goodreads Author), Katarina Ganslandt (Translator)",4.25,"Eine Liebesgeschichte aus der Doppelperspektive von Sky und Dean von der Bestellerautorin Colleen Hoover. Preisattraktives eBundle!

Die beiden Bestseller “Hope Forever und ""Looking for Hope"" jetzt als preisattraktives eBundle!


Die 17-jährige Sky ist starken Gefühlen aus dem Weg gegangen – bis sie Dean Holder trifft, der ihre Hormone tanzen lässt. Doch dann tun sich Abgründe aus der Vergangenheit auf, die tiefer und dunkler sind, als Sky sich vorstellen kann. Und sie haben mehr mit Dean zu tun, als ihr lieb ist. Wenn es eine Zukunft für ihre Liebe geben soll, müssen beide, Sky und Dean, sich den Geistern der Vergangenheit stellen …
(less)",https://i.gr-assets.com/images/S/compressed.photo.goodreads.com/books/1481274917l/33297186._SY475_.jpg,0836d55f-80cf-4deb-ab31-d738adbea6f0
,https://www.goodreads.com/book/show/60497404-summary-of-reminders-of-him-by-colleen-hoover?from_search=true&from_srp=true&qid=1t02z5usua&rank=45,60497404,Summary of Reminders of Him by Colleen Hoover,by Pandabook Plus,4.00,no book description available,https://i.gr-assets.com/images/S/compressed.photo.goodreads.com/books/1645837880l/60497404._SY475_.jpg,7e2d3d1d-600e-402d-b89b-8efdfcb23a6c
,https://www.goodreads.com/book/show/25402412-ugly-love-maybe-someday-maybe-not?from_search=true&from_srp=true&qid=1t02z5usua&rank=46,25402412,Ugly Love / Maybe Someday / Maybe Not,by Colleen Hoover (Goodreads Author),4.50,"Three of #1 New York Times bestselling author Colleen Hoover’s most irresistible books, Ugly Love, Maybe Someday, and the novella Maybe Not, gathered together in one collection for the first time.

Ugly Love: When Tate Collins meets airline pilot Miles Archer, it isn’t exactly love at first sight. But there is an undeniable mutual attraction. Once their desires are out in the open, they realize they have the perfect set-up: he doesn’t want love, she doesn’t have time for a relationship, so that just leaves the mind-blowing sex. The arrangement could be seamless, as long as Tate never asks about the past and doesn’t expect a future.

Maybe Someday: Sydney’s perfect life is thrown into disarray when she discovers that her boyfriend is cheating on her, and she finds herself captivated by her mysterious neighbor, Ridge. Sydney can't take her eyes off him or stop listening to the passionate guitar music he plays every evening. As the music swells, they soon find themselves needing each other in unexpected ways.

Maybe Not: Warren needs a roommate. Enter cold, calculating Bridgette. Tensions run high and tempers flare as the two can hardly stand to be in the same room together. But Warren has a theory: anyone who can hate with such passion must also have the capability to love with such passion. Will Bridgette find herself finally able to love? (less)",https://i.gr-assets.com/images/S/compressed.photo.goodreads.com/books/1429644839l/25402412.jpg,8b138e26-c781-4c3c-87ad-b96ea5af34f5
,https://www.goodreads.com/book/show/60107514-colleen-hoover-series-reading-order-guide?from_search=true&from_srp=true&qid=1t02z5usua&rank=47,60107514,"Colleen Hoover Series Reading Order & Guide: Verity, Slammed Series, Hopeless Series, and every other book! (SeriesBookList.com Author Guides)",by Booklist,3.50,no book description available,https://i.gr-assets.com/images/S/compressed.photo.goodreads.com/books/1641955949l/60107514._SY475_.jpg,bf41ca3b-4fd2-45ca-ab53-85402617b794
,https://www.goodreads.com/book/show/35618641-will-und-layken---eine-gro-e-liebe?from_search=true&from_srp=true&qid=1t02z5usua&rank=48,35618641,Will und Layken - Eine große Liebe,"by Colleen Hoover (Goodreads Author), Katarina Ganslandt (Translator)",4.19,"Was, wenn du die große Liebe triffst und das Leben dazwischenkommt?

Nach dem Unfalltod ihres Vaters zieht die 18-jährige Layken mit ihrer Mutter und ihrem Bruder von Texas nach Michigan. Nie hätte Layken gedacht, dass sie sich dort bereits am ersten Tag Hals über Kopf verliebt. Und dass diese Liebe mit derselben Intensität erwidert wird. Es sind die ganz großen Gefühle zwischen Layken und Will. Das ganz große Glück - drei Tage lang. Denn dann stellt das Leben sich ihrer Liebe mit aller Macht in den Weg…
(less)",https://i.gr-assets.com/images/S/compressed.photo.goodreads.com/books/1499456691l/35618641._SY475_.jpg,e305313f-5f1e-4995-934b-b01eddce7e3f
,https://www.goodreads.com/book/show/28020593-colleen-hoover?from_search=true&from_srp=true&qid=1t02z5usua&rank=49,28020593,"Colleen Hoover: Series Reading Order: A Read to Live, Live to Read Checklist [Slammed Series, Hopeless Series, Maybe Series]",by Rita Bookman,3.40,"CIRCULAR 34 FROM THE UNITED STATES COPYRIGHT OFFICE STATES:
COPYRIGHT PROTECTION IS NOT AVAILABLE FOR NAMES, TITLES OR SHORT PHRASES


DO YOU LOVE TO READ? DO YOU READ EVERYDAY? DO YOU LIKE TO READ EVERYTHING YOUR FAVORITE AUTHOR HAS WRITTEN?

DO YOU READ TO LIVE, AND READ TO LIVE?

THIS SIMPLE TO USE, THERE WHEN YOU NEED IT CHECKLIST CAN HELP YOU KEEP TRACK OF WHICH BOOKS YOU'VE READ
AND WHICH BOOK YOU NEED TO READ NEXT.

THIS READ TO LIVE, LIVE TO READ CHECKLIST WILL BE RIGHT ON YOUR FAVORIT E-READING DEVICE WHEN YOU NEED IT.

JUST HIGHLIGHT THE BOOKS YOU'VE READ, AND CHECK TO SEE WHICH BOOK YOU SHOULD READ NEXT.

YOUR READ TO LIVE, LIVE TO READ CHECKLIST WILL BE AUTOMATICALLY UPDATED AND READY
WHEN YOU NEED IT NEXT

UNITED STATES COPYRIGHT OFFICE, CIRCULAR 34 STATES: COPYRIGHT PROTECTION IS NOT AVAILABLE FOR NAMES, TITLES
OR SHORT PHRASES. THIS AND OTHER LISTS OF THIS KIND CONTAIN ONLY NON-COPYRIGHTABLE MATERIAL.

GET YOUR

READ TO LIVE, LIVE TO READ
CHECKLIST

TODAY!


UNITED STATES COPYRIGHT OFFICE

CIRCULAR 34: COPYRIGHT PROTECTION NOT AVAILABLE FOR NAMES, TITLES OR SHORT PHRASES---CLICK HERE TO VIEW ON COPYRIGHT.GOV WEBSITE



HOW TO USE THIS CHECK LIST

1. HIGHLIGHT THE BOOKS THAT YOU HAVE READ
a. Put your finger on the title of the book and drag it across the whole title
b. When the pop up window appears press highlight

2. ACTIVATE KINDLE’S AUTOMATIC UPDATE FEATURE to receive Automated list updates
a. Sign into your Amazon account
b. Click on manage your content and devices
c. Click on Devices
d. Scroll down to Automatic Book Updates

Colleen Hoover

Slammed Series
Hopeless Series
Maybe Series
Standalone Novels (less)",https://i.gr-assets.com/images/S/compressed.photo.goodreads.com/books/1448927737l/28020593._SX318_.jpg,96e26875-7eb1-4e7f-92c3-b3c66cc3dfd2
,https://www.goodreads.com/book/show/40233050-summary-of-ugly-love-by-colleen-hoover-conversation-starters?from_search=true&from_srp=true&qid=1t02z5usua&rank=50,40233050,Summary of Ugly Love by Colleen Hoover | Conversation Starters,by BookHabits,4.50,"Ugly Love by Colleen Hoover | Conversation Starters


A Brief Look Inside:


EVERY GOOD BOOK CONTAINS A WORLD FAR DEEPER than the surface of its pages. The characters and their world come alive, and the characters and its world still live on. Conversation Starters is peppered with questions designed to bring us beneath the surface of the page and invite us into the world that lives on.


These questions can be used to...
Create Hours of Conversation:


• Promote an atmosphere of discussion for groups
• Foster a deeper understanding of the book
• Assist in the study of the book, either individually or corporately
• Explore unseen realms of the book as never seen before


Disclaimer: This book you are about to enjoy is an independent resource meant to supplement the original book. If you have not yet read the original book, we encourage doing before purchasing this unofficial Conversation Starters. (less)",https://i.gr-assets.com/images/S/compressed.photo.goodreads.com/books/1527607412l/40233050._SY475_.jpg,0751bab5-92a6-4a60-855a-7b17250c02e7
,https://www.goodreads.com/book/show/60432800-colleen-hoover-books?from_search=true&from_srp=true&qid=1t02z5usua&rank=51,60432800,Colleen Hoover Books: The Biography of Colleen Hoover: Author of It Ends with Us,by Varsity Press,3.33,no book description available,https://i.gr-assets.com/images/S/compressed.photo.goodreads.com/books/1645059354l/60432800._SX318_.jpg,099d8583-e830-41f9-a589-970530caf8e0
,https://www.goodreads.com/book/show/59112062-summary-of-it-ends-with-us-by-colleen-hoover?from_search=true&from_srp=true&qid=1t02z5usua&rank=52,59112062,Summary of It Ends With Us by Colleen Hoover,by riyan press publication,4.67,no book description available,https://i.gr-assets.com/images/S/compressed.photo.goodreads.com/books/1632885522l/59112062._SY475_.jpg,225d6c09-72d7-417a-915f-5dbde3e14fb3
,https://www.goodreads.com/book/show/36822581-analysis?from_search=true&from_srp=true&qid=1t02z5usua&rank=53,36822581,"Analysis: Without Merit: A Novel by Colleen Hoover, When Merit Voss Learns a Family Secret, She Tries to Escape the Family But Fails and Must Face the Consequences.",by James Zimmerhoff,3.33,"Without Merit You will recognize Colleen Hoover for relatable characters and even more relatable storylines, with themes that hook a reader in while giving their heart an emotional squeeze. Suffice it to say you won't regret spending a few hours with the Voss family. They're quirky and dysfunctional to a high degree, but it's when secrets get told that the redemption begins. Not every mistake justifies a consequence. Sometimes the only thing it warrants is forgiveness. The Voss family is anything but typical. They live in a repurposed church, recently baptized Dollar Voss. The cancer survivor mother lives in the basement, the father is wedded to the mother's former nurse, the young half-brother isn't allowed to do or eat anything fun, and the eldest siblings are irritatingly perfect. Then, there's Merit. This family is crazy and has so many secrets; their secrets have secrets. Merit Voss collects trophies she hasn't merited and secrets her family urges her to keep. While browsing the neighborhood antique shop for her next award, she finds Sagan. His wit and unapologetic idealism disarm and spark renewed life into her until the discovery that he's unavailable. Merit retreats farther into herself, seeing her family from the sidelines when she discovers a secret that no trophy in the world can correct. Merit decides to destroy the happy family fantasy that she's never been a part of before escaping them behind for good. When her leave plan fails, Merit is obligated to deal with the tremendous consequences of telling the truth and losing the one man she loves. This book was nothing like any other book Colleen has written. It's unconventional, quirky, and completely relatable. This story is the first book of Colleen's that doesn't make you cry. But it still makes you feel so many emotions, just as all of her books do. I love how she always touches on real-life topics that not usually discussed in novels, such as the Syrian War and gender roles/identity. Colleen is brilliant and a pure genius. In every book she writes, she always takes a black and white situation and shows us the shades of gray. A different side of the issue. She has, more than once, it will change the way you look at many things. If she is trying to make the world a better place with her books, then she's on the right path. You are now, closer to a better world. Her mark will most definitely stay on this earth, and many people's heart. Colleen Hoover Colleen Hoover BornMargaret Colleen Fite[1] December 11, 1979 Sulphur Springs, TX, US OccupationTarryn Fisher's best friend & Author NationalityAmerican EducationB.A., Social Work Alma materTexas A&M-Commerce GenreYoung adult fiction and New-adult fiction Literary movementTarryn Lover Notable works Singer Slammed Point of Retreat This Girl Hopeless Losing Hope Finding Cinderella Maybe Someday Maybe Not Ugly Love November Nine Confess It Ends With Us Without Merit SpouseWilliam Heath Hoover (less)",https://i.gr-assets.com/images/S/compressed.photo.goodreads.com/books/1515205234l/36822581.jpg,341c655f-5072-4507-90d0-8b0aa8b83c26
,https://www.goodreads.com/book/show/60219210-summary-of-reminders-of-him-by-colleen-hoover?from_search=true&from_srp=true&qid=1t02z5usua&rank=54,60219210,SUMMARY OF REMINDERS OF HIM BY COLLEEN HOOVER: A NOVEL,by Thomas Graham,4.29,no book description available,https://i.gr-assets.com/images/S/compressed.photo.goodreads.com/books/1643220615l/60219210._SY475_.jpg,1d3d4ef7-aad7-49db-bf1f-6a7803d4ec1a
,https://www.goodreads.com/book/show/36567675-maybe-someday-maybe-not?from_search=true&from_srp=true&qid=1t02z5usua&rank=55,36567675,Maybe Someday / Maybe Not,"by Colleen Hoover (Goodreads Author), Kattrin Stier (Translator)",4.22,"Zweimal Hoover, zweimal Liebe!
Maybe Someday: Als Sydney ihren Freund in flagranti mit ihrer Mitbewohnerin erwischt, sucht sie spontan Zuflucht bei ihrem Nachbarn, dem Gitarristen Ridge. Das Letzte, was Sydney will, ist, sich in Ridge zu verlieben – denn Ridge hat eine Freundin. Doch als sie das erfährt, ist es schon zu spät…
Maybe Not: Als Bridgette in Warrens WG einzieht, kann er sein Glück kaum fassen. Denn seine neue Mitbewohnerin ist überaus attraktiv und sexy. Doch Warren gegenüber verhält sich Bridgette kaltschnäuzig und abweisend. Offensichtlich hasst sie ihn aufs Blut … oder doch nicht?
(less)",https://i.gr-assets.com/images/S/compressed.photo.goodreads.com/books/1510284805l/36567675._SY475_.jpg,488906a9-df62-43fc-af8e-54ebd3bde082
,https://www.goodreads.com/book/show/18070971-atria-books?from_search=true&from_srp=true&qid=1t02z5usua&rank=56,18070971,Atria Books: A Booklovers Sampler,"by Colleen Hoover (Goodreads Author), Jamie McGuire (Goodreads Author), Katja Millay (Goodreads Author), Raine Miller (Goodreads Author), Tina Reber (Goodreads Author), K.A. Tucker (Goodreads Author)",4.09,"SPECIAL GOODREADS GIVEAWAY EDITION

You’ve heard of love at first sight—but have you experienced love at first read? Introducing six of the most talented new voices in contemporary women’s fiction. Prepare to fall head over heels for…

Beautiful Disaster by Jamie McGuire
Abby Abernathy is a good girl, who could bring the ultimate bad boy to his knees…but not before the secrets of her own dark past come back to haunt her.

Love Unscripted by Tina Reber
Taryn Mitchell is nursing a recent heartbreak, and content to keep her distance from men for a while…until Hollywood’s most sought after actor walks into her small-town pub and turns her world upside down.

Naked by Raine Miller
Brynne Bennett is an American art student in London swept up in a torrid love affair with a sexy, successful businessman—who proves to be as domineering in the bedroom as he is in the boardroom.

One Tiny Lie by K.A. Tucker
After navigating the death of her parents and her older sister’s self-destructive phase, smart and stable Livie thinks Princeton should be a breeze—but Jell-O shots, a party-animal roommate she can’t say “no” to, and Ashton, the gorgeous but arrogant captain of the men’s rowing team were definitely not part of the plan…

The Sea of Tranquility by Katja Millay
A story of first love—and forever love: In the midst of a bustling high school, a fragile girl and a lonely boy find each other. As they grow closer, the attraction between them grows, too—but can either of them risk losing the friendship that’s saved them from their troubled pasts for a romance that might just shape their future?

Slammed by Colleen Hoover
The unexpected death of her father has left Layken feeling lost and invisible—until she meets Will, her new neighbor and a passionate poet. Sparks soon fly…but a shocking discovery could bring their relationship to a slamming halt before it’s even fully begun. (less)",https://i.gr-assets.com/images/S/compressed.photo.goodreads.com/books/1371078700l/18070971.jpg,3fbb72ad-33a9-4ae4-a25b-091874cea12d
,https://www.goodreads.com/book/show/43266219-list-of-books-by-colleen-hoover?from_search=true&from_srp=true&qid=1t02z5usua&rank=57,43266219,List of Books by Colleen Hoover : Never Never Series and list of all Colleen Hoover Books,by Frederick Juarbe,3.00,"Description
Reading order of:
Never Never Series
And an exhaustive list of all by Colleen Hoover books!
A complete list of every Colleen Hoover book published, to read and keep an easy track of, with links to the books on Amazon!
Get your copy now and be updated on Colleen Hoover books!

PLEASE NOTE: THIS IS A TITLE LIST ONLY, compiled for reference purposes to assist readers. No copyrighted material from the titles listed is included. This list is compliant with United States Copyright Office circular 34.
(less)",https://i.gr-assets.com/images/S/compressed.photo.goodreads.com/books/1545171908l/43266219._SY475_.jpg,52505428-75b8-410a-a976-419cc045549a
,https://www.goodreads.com/book/show/44278563-summary?from_search=true&from_srp=true&qid=1t02z5usua&rank=58,44278563,Summary: Colleen Hoover's Verity (Discussion Prompts),by Sarah Fields,3.80,"The #1 New York Times bestselling author Colleen Hoover writes a tragic romantic thriller entitled Verity. This book is about Lowen Ashleigh, a struggling writer who was on the brink of financial ruin. At this time, she accepted the job offer of a lifetime. It was the husband of bestselling author Verity Crawford who hired her. Jeremy Crawford needed Lowen to complete the remaining books that his wife couldn't finish in the successful series she was writing because of her injury. When Lowen started in the job, she found an unfinished autobiography that Verity never wanted for anyone to read. Because of the bone-chilling admissions in it, Lowen decided to keep the manuscript hidden from Jeremy. Its contents would forever devastate Jeremy. As Lowen develops romantic feelings for Jeremy, she thought he could benefit if he were to read the words of his wife. The horrifying truth that Jeremy read would make it impossible for him to continue loving Verity. In this comprehensive look into Verity by Colleen Hoover, you'll gain insight with this essential resource as a guide to aid your discussions. Be prepared to lead with the following: More than 60 ""done-for-you"" discussion prompts available Discussion aid which includes a wealth of information and prompts Overall brief plot synopsis and author biography as refreshers Thought-provoking questions made for deeper examinations Creative exercises to foster alternate ""if this was you"" discussions And more! Please Note: This is a companion guide based on the work Verity by Colleen Hoover not affiliated to the original work or author in any way and does not contain any text of the original work. Please purchase or read the original work first. (less)",https://leadershiftinsights.com/wp-content/uploads/2019/07/no-book-cover-available-300x300.jpg,773e1f16-4650-4868-b140-246772d7b9ce
,https://www.goodreads.com/book/show/59837376-summary-of-verity-by-colleen-hoover?from_search=true&from_srp=true&qid=1t02z5usua&rank=59,59837376,Summary of Verity by Colleen Hoover,by Rita Bennet,3.67,no book description available,https://i.gr-assets.com/images/S/compressed.photo.goodreads.com/books/1639695085l/59837376._SY475_.jpg,54f7190a-f839-48ee-93d5-09c6397122b2
,https://www.goodreads.com/book/show/26829240-ugly-love-episode-1?from_search=true&from_srp=true&qid=1t02z5usua&rank=60,26829240,Ugly Love Episode 1,by Colleen Hoover (Goodreads Author),4.36,"Par la plus grande auteure de romance aux États-Unis ! n°1 dans la liste des best-sellers du New York Times • n°1 dans la liste USA today • 3 000 avis positifs sur Amazon • 100 000 avis positifs sur Goodreads • En tête des ventes en Allemagne, Grande-Bretagne, Italie, etc. <br /> <br /> Après Maybe Someday, voici le deuxième titre de Colleen Hoover publié chez Hugo Roman. <br />

Quand Tate Collins rencontre Miles Archer, elle sait que ce n'est pas le coup de foudre. Et pour cause, le beau pilote n'a de temps que pour les aventures sans lendemain. Ils ne peuvent pourtant pas nier leur attraction mutuelle, aussi immédiate que brûlante.



Alors pourquoi ne pas se laisser séduire, quand le sexe est si bon ? Pas d'attaches, simplement la passion... Leur arrangement semble parfait, tant que Tate accepte de respecter les deux règles de Miles :




Pas de question sur le passé, Ne pas espérer de futur.



Cependant, ils vont vite comprendre que le coeur ne suit pas d'autres règles que les siennes. L'amour, même quand il n'est pas une évidence, sera-t-il plus fort que leurs promesses ?
(less)",https://i.gr-assets.com/images/S/compressed.photo.goodreads.com/books/1443436701l/26829240._SY475_.jpg,b8f08239-a0e0-4c9c-b1d4-f55a7150b08c
,https://www.goodreads.com/book/show/58865808-summary-of-colleen-hoover-s-novel-it-ends-with-us?from_search=true&from_srp=true&qid=1t02z5usua&rank=61,58865808,"Summary of Colleen Hoover's novel, ""It ends with us""",by Drew Philips,5.00,no book description available,https://i.gr-assets.com/images/S/compressed.photo.goodreads.com/books/1630035519l/58865808._SY475_.jpg,3456c181-316b-4f2c-bea9-5bcd9aa45173
,https://www.goodreads.com/book/show/58628074-layla-acompanha-kit-com-p-ster-marcadores-e-cards-accessory-hoover?from_search=true&from_srp=true&qid=1t02z5usua&rank=62,58628074,"Layla (Acompanha Kit com Pôster, Marcadores e Cards) [accessory] Hoover, Colleen and Catão, Priscila",by autor,3.60,no book description available,https://i.gr-assets.com/images/S/compressed.photo.goodreads.com/books/1627258602l/58628074._SX318_.jpg,3599d13d-e2d6-4f3d-9bd8-5355c7f042f5
,https://www.goodreads.com/book/show/26973240-ugly-love-episode-2?from_search=true&from_srp=true&qid=1t02z5usua&rank=63,26973240,Ugly Love Episode 2,"by Colleen Hoover (Goodreads Author), Pauline Vidal (Translator)",4.51,"Par la plus grande auteure de romance aux États-Unis ! n°1 dans la liste des best-sellers du New York Times • n°1 dans la liste USA today • 3 000 avis positifs sur Amazon • 100 000 avis positifs sur Goodreads • En tête des ventes en Allemagne, Grande-Bretagne, Italie, etc. <br /> <br /> Après Maybe Someday, voici le deuxième titre de Colleen Hoover publié chez Hugo Roman. <br />
Quand Tate Collins rencontre Miles Archer, elle sait que ce n'est pas le coup de foudre. Et pour cause, le beau pilote n'a de temps que pour les aventures sans lendemain. Ils ne peuvent pourtant pas nier leur attraction mutuelle, aussi immédiate que brûlante.


Alors pourquoi ne pas se laisser séduire, quand le sexe est si bon ? Pas d'attaches, simplement la passion... Leur arrangement semble parfait, tant que Tate accepte de respecter les deux règles de Miles :



Pas de question sur le passé, Ne pas espérer de futur.



Cependant, ils vont vite comprendre que le coeur ne suit pas d'autres règles que les siennes. L'amour, même quand il n'est pas une évidence, sera-t-il plus fort que leurs promesses ?
(less)",https://i.gr-assets.com/images/S/compressed.photo.goodreads.com/books/1444345218l/26973240._SY475_.jpg,91df7944-f0e5-48a6-91ac-458c87f59d6e
,https://www.goodreads.com/book/show/60478828-summary-of-it-ends-with-us-by-colleen-hoover?from_search=true&from_srp=true&qid=1t02z5usua&rank=64,60478828,SUMMARY Of IT ENDS WITH US By Colleen Hoover,by James Gerald,3.33,no book description available,https://i.gr-assets.com/images/S/compressed.photo.goodreads.com/books/1645591426l/60478828._SY475_.jpg,cd1dfc47-c0c6-4646-9f80-ac03d179926e
